{
  "$schema": "http://json-schema.org/draft-07/schema#",
  "title": "review step answer",
  "description": "A verdict, and every finding behind it, each carrying the grade that decides what it costs. Critical, Major and Minor send the work back and are fixed in this change; a Nit is dropped. The verdict is read off the grades, never typed beside them: SHIP with a Critical, Major or Minor, and BLOCKED with none, are both refused.",
  "type": "object",
  "additionalProperties": false,
  "required": [
    "step",
    "skills",
    "status",
    "round",
    "verdict",
    "findings"
  ],
  "properties": {
    "step": {
      "const": "review"
    },
    "skills": {
      "description": "Every Superpowers skill invoked in this step. The driver cross-checks this against the Skill calls in the run log, so a claim here the log does not show is a failed step.",
      "type": "array",
      "minItems": 1,
      "items": {
        "type": "string",
        "pattern": "^superpowers:[a-z][a-z-]*$"
      }
    },
    "status": {
      "enum": [
        "reviewed",
        "park"
      ]
    },
    "round": {
      "description": "Which review round this is. The driver allows two; a blocking finding left after that keeps the change from merging.",
      "type": "integer",
      "minimum": 1
    },
    "verdict": {
      "enum": [
        "SHIP",
        "BLOCKED"
      ]
    },
    "findings": {
      "description": "Everything this review raised, at every grade. One list, because the grade already says what each one costs \u2014 a second list saying the same thing is a second place for the two to disagree.",
      "type": "array",
      "items": {
        "type": "object",
        "additionalProperties": false,
        "required": [
          "id",
          "file",
          "line",
          "grade",
          "summary",
          "reason",
          "fix"
        ],
        "properties": {
          "id": {
            "type": "string",
            "minLength": 1
          },
          "file": {
            "type": "string",
            "minLength": 1
          },
          "line": {
            "description": "The line the finding is on. 0 when it is on no line of a file: the pull request's body, a file that is missing.",
            "type": "integer",
            "minimum": 0
          },
          "grade": {
            "description": "critical: wrong data, a security hole, lost work, something published unapproved. major: a person is misled or stuck \u2014 an untrue screen, a dead control, a failure shown as success. minor: polish \u2014 spacing, wording, a small visual slip. nit: taste.",
            "enum": [
              "critical",
              "major",
              "minor",
              "nit"
            ]
          },
          "summary": {
            "type": "string",
            "minLength": 1
          },
          "reason": {
            "description": "One line, in a user's words, saying why this grade. A Critical or a Major names who is harmed and how; a grade with no harm behind it is a Minor wearing a blocker's label.",
            "type": "string",
            "minLength": 1
          },
          "fix": {
            "type": "string",
            "minLength": 1
          }
        }
      }
    },
    "question": {
      "description": "Why this step cannot finish. Answerable in a line: a yes/no or a pick.",
      "type": "string",
      "minLength": 1
    },
    "questionFor": {
      "description": "Who answers the question. `owner`: pixels, a picture, a product or commercial call, or the data model. `pm`: the ticket's shape \u2014 which repo, how it splits, the order, the wording of its acceptance. Unsure is `owner`; the driver treats anything but `pm` as the owner's.",
      "enum": [
        "owner",
        "pm"
      ]
    },
    "notes": {
      "type": "string"
    }
  },
  "allOf": [
    {
      "if": {
        "properties": {
          "verdict": {
            "const": "SHIP"
          }
        },
        "required": [
          "verdict"
        ]
      },
      "then": {
        "properties": {
          "findings": {
            "not": {
              "type": "array",
              "contains": {
                "type": "object",
                "required": [
                  "grade"
                ],
                "properties": {
                  "grade": {
                    "enum": [
                      "critical",
                      "major",
                      "minor"
                    ]
                  }
                }
              }
            }
          }
        }
      }
    },
    {
      "if": {
        "properties": {
          "verdict": {
            "const": "BLOCKED"
          }
        },
        "required": [
          "verdict"
        ]
      },
      "then": {
        "properties": {
          "findings": {
            "type": "array",
            "contains": {
              "type": "object",
              "required": [
                "grade"
              ],
              "properties": {
                "grade": {
                  "enum": [
                    "critical",
                    "major",
                    "minor"
                  ]
                }
              }
            }
          }
        }
      }
    }
  ]
}
