{
  "step": "review",
  "skills": [
    "superpowers:requesting-code-review"
  ],
  "status": "reviewed",
  "round": 2,
  "verdict": "SHIP",
  "findings": [
    {
      "id": "f1",
      "file": "src/queue/panel.tsx",
      "line": 88,
      "grade": "nit",
      "summary": "prefers a shorter variable name",
      "reason": "taste",
      "fix": "rename if you like"
    }
  ],
  "notes": "one Nit left. It is dropped; it never held this round."
}
